contract_id,artifact_type,expected_path_pattern,produced_in_f0,qgis_required,solweig_required,required_keys,required_metrics,forbidden_claims,notes
run_matrix,preflight_manifest_csv,outputs/v12_surrogate/b8_5_multiforcing_preflight/b85_f0_solweig_run_matrix.csv,yes,no,no,"run_id,cell_id,forcing_day_id,date,hour_sgt,scenario",planned row count and coverage only,"No local WBGT, hazard_score, risk_score, or AOI-wide inference.",Authoritative B8.5-F0 protocol matrix.
future_solweig_tmrt_rasters,future_qgis_solweig_raster_outputs,future controlled SOLWEIG work directory per expected_output_group/Tmrt_average.tif,no,yes,yes,"run_id,cell_id,forcing_day_id,hour_sgt,scenario",valid raster exists only after approved execution,Raster Tmrt must not be described as WBGT or risk.,Path pattern is a future contract only; B8.5-F0 creates no raster files.
future_focus_tmrt_summary,future_aggregation_csv,outputs/v12_surrogate/b8_5_multiforcing_preflight/future_b85_focus_tmrt_summary.csv,no,after_execution,after_execution,"run_id,cell_id,forcing_day_id,date,hour_sgt,scenario","tmrt_mean_c,tmrt_p50_c,tmrt_p75_c,tmrt_p90_c,tmrt_p95_c,tmrt_max_c,valid_pixel_count",No WBGT conversion and no hazard/risk score.,Must be machine-readable and traceable to the run matrix.
future_delta_targets,future_delta_modifier_csv,outputs/v12_surrogate/b8_5_multiforcing_preflight/future_b85_modifier_targets_by_forcing_day.csv,no,after_execution,after_execution,"cell_id,forcing_day_id,date,hour_sgt,scenario","delta_tmrt_p90_c,m_rad_pct01,reference_rule,n_reference_cells",Delta Tmrt is not delta WBGT and m_rad_pct01 is not risk.,"Use same-hour, same-scenario, same-forcing-day reference rules unless explicitly revised."
future_stability_metrics,future_protocol_metrics_csv_md,outputs/v12_surrogate/b8_5_multiforcing_preflight/future_b85_multiforcing_stability_metrics.*,no,after_execution,after_execution,"metric_id,scenario,hour_sgt,forcing_day_pair,aggregation_level","rank_correlation,top_k_overlap,sign_stability,m_rad_pct01_rank_stability,cell_class_stability,unstable_cell_flags",Stability evidence is not validation of local WBGT prediction.,Metrics defined in b85_f0_stability_metrics_protocol.md.
