gate_id,recommendation,decision,rationale,trigger,blocked_until
accept_p_ge31_companion,ACCEPT A-L1H.2 P_ge31 as diagnostic companion.,ACCEPT,Best candidate M4 + isotonic_score_only has usable station-held-out retrospective reliability and improved ge31 operating-point behavior.,Current A-L1H.2b package publication.,No block for internal retrospective use.
hold_a_l2,HOLD A-L2.,HOLD,Station context remains diagnostic; A-L2 was explicitly out of scope and should not start from this integration task.,Explicit user issue after Level 1 contract review.,Separate A-L2 gate approval.
optional_a_l1h3,OPTIONAL A-L1H.3 high-tail regression review gate only if further high-tail improvement is desired.,OPTIONAL,P_ge31 companion materially improves ge31 capture but does not fully solve high tail.,User requests more high-tail improvement after accepting current contract.,Separate A-L1H.3 issue / branch.
prospective_eval,REQUIRE prospective metadata / lead-time evaluation before operational forecast claims.,REQUIRE,Current evidence is retrospective OOF; no prospective forecast skill has been evaluated.,Any operational or public-facing claim.,Prospective evaluation PASS.
current_contract,Use this integration report as the System A Level 1 current contract.,ACCEPT,It defines WBGT_A score as primary and P_ge31 as diagnostic companion with explicit boundaries.,A-L1H.2b PASS.,No block for documentation use.
no_broad_model_search,Do not try other models now unless a separate A-L1H.3 review gate is opened.,HOLD,"This lane is integration / model-card / output-contract work, and A-L1H.2 already selected a diagnostic companion.",Only after user asks for high-tail regression or model comparison.,Separate scoped review.
